{
  "name": "custom-module",
  "version": "2026-03-19",
  "capabilities": {
    "cli": false,
    "daemon": false,
    "mcp_server": false,
    "skill_provider": false,
    "hook_provider": false,
    "transport": false
  },
  "healthcheck": {
    "command": "echo healthy",
    "timeout_ms": 5000
  },
  "attach": {
    "install_command": "",
    "post_install": [],
    "env_vars": {}
  },
  "depends_on": []
}
